2. desc Student;
+--------+--------------+------+-----+---------+-------+
| Field  | Type         | Null | Key | Default | Extra |
+--------+--------------+------+-----+---------+-------+
| USN    | varchar(20)  | NO   | PRI | NULL    |       |
| Name   | varchar(20)  | NO   |     | NULL    |       |
| DOB    | date         | NO   |     | NULL    |       |
| Branch | varchar(20)  | NO   |     | NULL    |       |
| M1     | int          | YES  |     | NULL    |       |
| M2     | int          | YES  |     | NULL    |       |
| M3     | int          | YES  |     | NULL    |       |
| Total  | int          | YES  |     | NULL    |       |
| GPA    | decimal(3,2) | YES  |     | NULL    |       |
+--------+--------------+------+-----+---------+-------+
9 rows in set (0.00 sec)
select * from Student;
+------------+-------------+------------+--------+------+------+------+-------+------+
| USN        | Name        | DOB        | Branch | M1   | M2   | M3   | Total | GPA  |
+------------+-------------+------------+--------+------+------+------+-------+------+
| 4VP21MC040 | Sandhya     | 2000-02-01 | MBA    | NULL | NULL | NULL |  NULL | NULL |
| 4VP21MC041 | Shruthi     | 2001-02-01 | MCA    | NULL | NULL | NULL |  NULL | NULL |
| 4VP21MC042 | Rashmi      | 2002-02-01 | CIVIL  | NULL | NULL | NULL |  NULL | NULL |
| 4VP21MC043 | Geethanjali | 2003-02-01 | CS     | NULL | NULL | NULL |  NULL | NULL |
| 4VP21MC044 | Puneethraj  | 2004-02-01 | Mech   | NULL | NULL | NULL |  NULL | NULL |
+------------+-------------+------------+--------+------+------+------+-------+------+
5 rows in set (0.01 sec)
update Student set M1="90",M2="70",M3="90" where USN="4VP21MC045";
Query OK, 0 rows affected (0.00 sec)
Rows matched: 0  Changed: 0  Warnings: 0

mysql> update Student set M1="90",M2="70",M3="90" where USN="4VP21MC040";
Query OK, 1 row affected (0.01 sec)
Rows matched: 1  Changed: 1  Warnings: 0

mysql> update Student set M1="100",M2="100",M3="100" where USN="4VP21MC041";
Query OK, 1 row affected (0.01 sec)
Rows matched: 1  Changed: 1  Warnings: 0

mysql> update Student set M1="70",M2="60",M3="25" where USN="4VP21MC042";
Query OK, 1 row affected (0.00 sec)
Rows matched: 1  Changed: 1  Warnings: 0

mysql> update Student set M1="35",M2="35",M3="35" where USN="4VP21MC043";
Query OK, 1 row affected (0.00 sec)
Rows matched: 1  Changed: 1  Warnings: 0

mysql> update Student set M1="70",M2="70",M3="70" where USN="4VP21MC044";
Query OK, 1 row affected (0.00 sec)
Rows matched: 1  Changed: 1  Warnings: 0

mysql> select * from Student;
+------------+-------------+------------+--------+------+------+------+-------+------+
| USN        | Name        | DOB        | Branch | M1   | M2   | M3   | Total | GPA  |
+------------+-------------+------------+--------+------+------+------+-------+------+
| 1001       | Sanvi       | 2000-06-11 | MCA    |   50 |   70 |   80 |  NULL | NULL |
| 4VP21MC040 | Sandhya     | 2000-02-01 | MBA    |   90 |   70 |   90 |  NULL | NULL |
| 4VP21MC041 | Shruthi     | 2001-02-01 | MCA    |  100 |  100 |  100 |  NULL | NULL |
| 4VP21MC042 | Rashmi      | 2002-02-01 | CIVIL  |   70 |   60 |   25 |  NULL | NULL |
| 4VP21MC043 | Geethanjali | 2003-02-01 | CS     |   35 |   35 |   35 |  NULL | NULL |
| 4VP21MC044 | Puneethraj  | 2004-02-01 | Mech   |   70 |   70 |   70 |  NULL | NULL |
+------------+-------------+------------+--------+------+------+------+-------+------+
6 rows in set (0.00 sec)

mysql> update Student set Total=M1+M2+M3;
Query OK, 6 rows affected (0.00 sec)
Rows matched: 6  Changed: 6  Warnings: 0

mysql> select * from Student;
+------------+-------------+------------+--------+------+------+------+-------+------+
| USN        | Name        | DOB        | Branch | M1   | M2   | M3   | Total | GPA  |
+------------+-------------+------------+--------+------+------+------+-------+------+
| 1001       | Sanvi       | 2000-06-11 | MCA    |   50 |   70 |   80 |   200 | NULL |
| 4VP21MC040 | Sandhya     | 2000-02-01 | MBA    |   90 |   70 |   90 |   250 | NULL |
| 4VP21MC041 | Shruthi     | 2001-02-01 | MCA    |  100 |  100 |  100 |   300 | NULL |
| 4VP21MC042 | Rashmi      | 2002-02-01 | CIVIL  |   70 |   60 |   25 |   155 | NULL |
| 4VP21MC043 | Geethanjali | 2003-02-01 | CS     |   35 |   35 |   35 |   105 | NULL |
| 4VP21MC044 | Puneethraj  | 2004-02-01 | Mech   |   70 |   70 |   70 |   210 | NULL |
+------------+-------------+------------+--------+------+------+------+-------+------+
6 rows in set (0.00 sec)

mysql> update Student set GPA=Total/3;
ERROR 1264 (22003): Out of range value for column 'GPA' at row 1
mysql> update Student set GPA=(Total/3);
ERROR 1264 (22003): Out of range value for column 'GPA' at row 1
mysql> update Student set GPA=Total/3;
ERROR 1264 (22003): Out of range value for column 'GPA' at row 1
mysql> alter table Student modify column GPA Float;
Query OK, 6 rows affected (0.04 sec)
Records: 6  Duplicates: 0  Warnings: 0

mysql> select * from Student;
+------------+-------------+------------+--------+------+------+------+-------+------+
| USN        | Name        | DOB        | Branch | M1   | M2   | M3   | Total | GPA  |
+------------+-------------+------------+--------+------+------+------+-------+------+
| 1001       | Sanvi       | 2000-06-11 | MCA    |   50 |   70 |   80 |   200 | NULL |
| 4VP21MC040 | Sandhya     | 2000-02-01 | MBA    |   90 |   70 |   90 |   250 | NULL |
| 4VP21MC041 | Shruthi     | 2001-02-01 | MCA    |  100 |  100 |  100 |   300 | NULL |
| 4VP21MC042 | Rashmi      | 2002-02-01 | CIVIL  |   70 |   60 |   25 |   155 | NULL |
| 4VP21MC043 | Geethanjali | 2003-02-01 | CS     |   35 |   35 |   35 |   105 | NULL |
| 4VP21MC044 | Puneethraj  | 2004-02-01 | Mech   |   70 |   70 |   70 |   210 | NULL |
+------------+-------------+------------+--------+------+------+------+-------+------+
6 rows in set (0.00 sec)

mysql> Desc Student;
+--------+-------------+------+-----+---------+-------+
| Field  | Type        | Null | Key | Default | Extra |
+--------+-------------+------+-----+---------+-------+
| USN    | varchar(20) | NO   | PRI | NULL    |       |
| Name   | varchar(20) | NO   |     | NULL    |       |
| DOB    | date        | NO   |     | NULL    |       |
| Branch | varchar(20) | NO   |     | NULL    |       |
| M1     | int         | YES  |     | NULL    |       |
| M2     | int         | YES  |     | NULL    |       |
| M3     | int         | YES  |     | NULL    |       |
| Total  | int         | YES  |     | NULL    |       |
| GPA    | float       | YES  |     | NULL    |       |
+--------+-------------+------+-----+---------+-------+
9 rows in set (0.01 sec)

mysql> update Student set GPA=Total/3;
Query OK, 6 rows affected (0.01 sec)
Rows matched: 6  Changed: 6  Warnings: 0

mysql> select * from Student;
+------------+-------------+------------+--------+------+------+------+-------+---------+
| USN        | Name        | DOB        | Branch | M1   | M2   | M3   | Total | GPA     |
+------------+-------------+------------+--------+------+------+------+-------+---------+
| 1001       | Sanvi       | 2000-06-11 | MCA    |   50 |   70 |   80 |   200 | 66.6667 |
| 4VP21MC040 | Sandhya     | 2000-02-01 | MBA    |   90 |   70 |   90 |   250 | 83.3333 |
| 4VP21MC041 | Shruthi     | 2001-02-01 | MCA    |  100 |  100 |  100 |   300 |     100 |
| 4VP21MC042 | Rashmi      | 2002-02-01 | CIVIL  |   70 |   60 |   25 |   155 | 51.6667 |
| 4VP21MC043 | Geethanjali | 2003-02-01 | CS     |   35 |   35 |   35 |   105 |      35 |
| 4VP21MC044 | Puneethraj  | 2004-02-01 | Mech   |   70 |   70 |   70 |   210 |      70 |
+------------+-------------+------------+--------+------+------+------+-------+---------+
6 rows in set (0.00 sec)

mysql> select year(DOB) from Student;
+-----------+
| year(DOB) |
+-----------+
|      2000 |
|      2000 |
|      2001 |
|      2002 |
|      2003 |
|      2004 |
+-----------+
6 rows in set (0.00 sec)

mysql> select * from Student where Branch="MCA";
+------------+---------+------------+--------+------+------+------+-------+---------+
| USN        | Name    | DOB        | Branch | M1   | M2   | M3   | Total | GPA     |
+------------+---------+------------+--------+------+------+------+-------+---------+
| 1001       | Sanvi   | 2000-06-11 | MCA    |   50 |   70 |   80 |   200 | 66.6667 |
| 4VP21MC041 | Shruthi | 2001-02-01 | MCA    |  100 |  100 |  100 |   300 |     100 |
+------------+---------+------------+--------+------+------+------+-------+---------+
2 rows in set (0.00 sec)

mysql> select name, branch from Student where Branch="Branch";
Empty set (0.00 sec)

mysql> select name, branch from Student where Branch=Branch;
+-------------+--------+
| name        | branch |
+-------------+--------+
| Sanvi       | MCA    |
| Sandhya     | MBA    |
| Shruthi     | MCA    |
| Rashmi      | CIVIL  |
| Geethanjali | CS     |
| Puneethraj  | Mech   |
+-------------+--------+
6 rows in set (0.00 sec)
 Select * from Student;
+------------+-------------+------------+--------+------+------+------+-------+---------+
| USN        | Name        | DOB        | Branch | M1   | M2   | M3   | Total | GPA     |
+------------+-------------+------------+--------+------+------+------+-------+---------+
| 1001       | Sanvi       | 2000-06-11 | MCA    |   50 |   70 |   80 |   200 | 66.6667 |
| 1002       | Tushar      | 2000-07-11 | MCA    |   70 |   70 |   70 |   210 |      70 |
| 4VP21MC040 | Sandhya     | 2000-02-01 | MBA    |   90 |   70 |   90 |   250 | 83.3333 |
| 4VP21MC041 | Shruthi     | 2001-02-01 | MCA    |  100 |  100 |  100 |   300 |     100 |
| 4VP21MC042 | Rashmi      | 2002-02-01 | CIVIL  |   70 |   60 |   25 |   155 | 51.6667 |
| 4VP21MC043 | Geethanjali | 2003-02-01 | CS     |   35 |   35 |   35 |   105 |      35 |
| 4VP21MC044 | Puneethraj  | 2004-02-01 | Mech   |   70 |   70 |   70 |   210 |      70 |
+------------+-------------+------------+--------+------+------+------+-------+---------+
7 rows in set (0.00 sec)
mysql> select name from Student where name like "%AR";
+--------+
| name   |
+--------+
| Tushar |
+--------+
1 row in set (0.00 sec)

mysql> select name from Student where name like "S%";
+---------+
| name    |
+---------+
| Sanvi   |
| Sandhya |
| Shruthi |
+---------+
3 rows in set (0.00 sec)

mysql> select max(GPA),Branch from Student group by Branch;
+----------+--------+
| max(GPA) | Branch |
+----------+--------+
|      100 | MCA    |
|  83.3333 | MBA    |
|  51.6667 | CIVIL  |
|       35 | CS     |
|       70 | Mech   |
+----------+--------+
5 rows in set (0.00 sec)

mysql> delete from Student where USN="1001";
Query OK, 1 row affected (0.01 sec)

mysql> select * from Student;
+------------+-------------+------------+--------+------+------+------+-------+---------+
| USN        | Name        | DOB        | Branch | M1   | M2   | M3   | Total | GPA     |
+------------+-------------+------------+--------+------+------+------+-------+---------+
| 1002       | Tushar      | 2000-07-11 | MCA    |   70 |   70 |   70 |   210 |      70 |
| 4VP21MC040 | Sandhya     | 2000-02-01 | MBA    |   90 |   70 |   90 |   250 | 83.3333 |
| 4VP21MC041 | Shruthi     | 2001-02-01 | MCA    |  100 |  100 |  100 |   300 |     100 |
| 4VP21MC042 | Rashmi      | 2002-02-01 | CIVIL  |   70 |   60 |   25 |   155 | 51.6667 |
| 4VP21MC043 | Geethanjali | 2003-02-01 | CS     |   35 |   35 |   35 |   105 |      35 |
| 4VP21MC044 | Puneethraj  | 2004-02-01 | Mech   |   70 |   70 |   70 |   210 |      70 |
+------------+-------------+------------+--------+------+------+------+-------+---------+
6 rows in set (0.00 sec)


